[
  {
    "id": "unit_militia",
    "category": "troop_master",
    "name": "Militia",
    "provider": "Higgsfield",
    "status": "PLANNED_NOT_GENERATED",
    "approval": "PENDING",
    "source_path": null,
    "sha256": null,
    "rights_evidence": null,
    "rig": "biped",
    "exchange": "segmented transparent PNG + pivots + original master",
    "commercial_clearance_required": true
  },
  {
    "id": "portrait_militia",
    "category": "unit_portrait",
    "name": "Militia portrait",
    "provider": "derived_from_approved_master",
    "status": "PLANNED_NOT_GENERATED",
    "approval": "PENDING",
    "source_path": null,
    "sha256": null,
    "rights_evidence": null,
    "depends_on": [
      "unit_militia"
    ]
  },
  {
    "id": "anim_militia_idle",
    "category": "animation_binding",
    "name": "Militia idle",
    "provider": "Unity editor / Codex",
    "status": "PLANNED_NOT_GENERATED",
    "approval": "PENDING",
    "source_path": null,
    "sha256": null,
    "rights_evidence": null,
    "depends_on": [
      "unit_militia"
    ],
    "reuse_allowed": true,
    "sim_authoritative": true
  },
  {
    "id": "anim_militia_move",
    "category": "animation_binding",
    "name": "Militia move",
    "provider": "Unity editor / Codex",
    "status": "PLANNED_NOT_GENERATED",
    "approval": "PENDING",
    "source_path": null,
    "sha256": null,
    "rights_evidence": null,
    "depends_on": [
      "unit_militia"
    ],
    "reuse_allowed": true,
    "sim_authoritative": true
  },
  {
    "id": "anim_militia_attack",
    "category": "animation_binding",
    "name": "Militia attack",
    "provider": "Unity editor / Codex",
    "status": "PLANNED_NOT_GENERATED",
    "approval": "PENDING",
    "source_path": null,
    "sha256": null,
    "rights_evidence": null,
    "depends_on": [
      "unit_militia"
    ],
    "reuse_allowed": true,
    "sim_authoritative": true
  },
  {
    "id": "anim_militia_hit",
    "category": "animation_binding",
    "name": "Militia hit",
    "provider": "Unity editor / Codex",
    "status": "PLANNED_NOT_GENERATED",
    "approval": "PENDING",
    "source_path": null,
    "sha256": null,
    "rights_evidence": null,
    "depends_on": [
      "unit_militia"
    ],
    "reuse_allowed": true,
    "sim_authoritative": true
  },
  {
    "id": "anim_militia_death",
    "category": "animation_binding",
    "name": "Militia death",
    "provider": "Unity editor / Codex",
    "status": "PLANNED_NOT_GENERATED",
    "approval": "PENDING",
    "source_path": null,
    "sha256": null,
    "rights_evidence": null,
    "depends_on": [
      "unit_militia"
    ],
    "reuse_allowed": true,
    "sim_authoritative": true
  },
  {
    "id": "anim_militia_victory",
    "category": "animation_binding",
    "name": "Militia victory",
    "provider": "Unity editor / Codex",
    "status": "PLANNED_NOT_GENERATED",
    "approval": "PENDING",
    "source_path": null,
    "sha256": null,
    "rights_evidence": null,
    "depends_on": [
      "unit_militia"
    ],
    "reuse_allowed": true,
    "sim_authoritative": true
  },
  {
    "id": "unit_shieldguard",
    "category": "troop_master",
    "name": "Shieldguard",
    "provider": "Higgsfield",
    "status": "PLANNED_NOT_GENERATED",
    "approval": "PENDING",
    "source_path": null,
    "sha256": null,
    "rights_evidence": null,
    "rig": "biped",
    "exchange": "segmented transparent PNG + pivots + original master",
    "commercial_clearance_required": true
  },
  {
    "id": "portrait_shieldguard",
    "category": "unit_portrait",
    "name": "Shieldguard portrait",
    "provider": "derived_from_approved_master",
    "status": "PLANNED_NOT_GENERATED",
    "approval": "PENDING",
    "source_path": null,
    "sha256": null,
    "rights_evidence": null,
    "depends_on": [
      "unit_shieldguard"
    ]
  },
  {
    "id": "anim_shieldguard_idle",
    "category": "animation_binding",
    "name": "Shieldguard idle",
    "provider": "Unity editor / Codex",
    "status": "PLANNED_NOT_GENERATED",
    "approval": "PENDING",
    "source_path": null,
    "sha256": null,
    "rights_evidence": null,
    "depends_on": [
      "unit_shieldguard"
    ],
    "reuse_allowed": true,
    "sim_authoritative": true
  },
  {
    "id": "anim_shieldguard_move",
    "category": "animation_binding",
    "name": "Shieldguard move",
    "provider": "Unity editor / Codex",
    "status": "PLANNED_NOT_GENERATED",
    "approval": "PENDING",
    "source_path": null,
    "sha256": null,
    "rights_evidence": null,
    "depends_on": [
      "unit_shieldguard"
    ],
    "reuse_allowed": true,
    "sim_authoritative": true
  },
  {
    "id": "anim_shieldguard_attack",
    "category": "animation_binding",
    "name": "Shieldguard attack",
    "provider": "Unity editor / Codex",
    "status": "PLANNED_NOT_GENERATED",
    "approval": "PENDING",
    "source_path": null,
    "sha256": null,
    "rights_evidence": null,
    "depends_on": [
      "unit_shieldguard"
    ],
    "reuse_allowed": true,
    "sim_authoritative": true
  },
  {
    "id": "anim_shieldguard_hit",
    "category": "animation_binding",
    "name": "Shieldguard hit",
    "provider": "Unity editor / Codex",
    "status": "PLANNED_NOT_GENERATED",
    "approval": "PENDING",
    "source_path": null,
    "sha256": null,
    "rights_evidence": null,
    "depends_on": [
      "unit_shieldguard"
    ],
    "reuse_allowed": true,
    "sim_authoritative": true
  },
  {
    "id": "anim_shieldguard_death",
    "category": "animation_binding",
    "name": "Shieldguard death",
    "provider": "Unity editor / Codex",
    "status": "PLANNED_NOT_GENERATED",
    "approval": "PENDING",
    "source_path": null,
    "sha256": null,
    "rights_evidence": null,
    "depends_on": [
      "unit_shieldguard"
    ],
    "reuse_allowed": true,
    "sim_authoritative": true
  },
  {
    "id": "anim_shieldguard_victory",
    "category": "animation_binding",
    "name": "Shieldguard victory",
    "provider": "Unity editor / Codex",
    "status": "PLANNED_NOT_GENERATED",
    "approval": "PENDING",
    "source_path": null,
    "sha256": null,
    "rights_evidence": null,
    "depends_on": [
      "unit_shieldguard"
    ],
    "reuse_allowed": true,
    "sim_authoritative": true
  },
  {
    "id": "unit_crossbowman",
    "category": "troop_master",
    "name": "Crossbowman",
    "provider": "Higgsfield",
    "status": "PLANNED_NOT_GENERATED",
    "approval": "PENDING",
    "source_path": null,
    "sha256": null,
    "rights_evidence": null,
    "rig": "biped",
    "exchange": "segmented transparent PNG + pivots + original master",
    "commercial_clearance_required": true
  },
  {
    "id": "portrait_crossbowman",
    "category": "unit_portrait",
    "name": "Crossbowman portrait",
    "provider": "derived_from_approved_master",
    "status": "PLANNED_NOT_GENERATED",
    "approval": "PENDING",
    "source_path": null,
    "sha256": null,
    "rights_evidence": null,
    "depends_on": [
      "unit_crossbowman"
    ]
  },
  {
    "id": "anim_crossbowman_idle",
    "category": "animation_binding",
    "name": "Crossbowman idle",
    "provider": "Unity editor / Codex",
    "status": "PLANNED_NOT_GENERATED",
    "approval": "PENDING",
    "source_path": null,
    "sha256": null,
    "rights_evidence": null,
    "depends_on": [
      "unit_crossbowman"
    ],
    "reuse_allowed": true,
    "sim_authoritative": true
  },
  {
    "id": "anim_crossbowman_move",
    "category": "animation_binding",
    "name": "Crossbowman move",
    "provider": "Unity editor / Codex",
    "status": "PLANNED_NOT_GENERATED",
    "approval": "PENDING",
    "source_path": null,
    "sha256": null,
    "rights_evidence": null,
    "depends_on": [
      "unit_crossbowman"
    ],
    "reuse_allowed": true,
    "sim_authoritative": true
  },
  {
    "id": "anim_crossbowman_attack",
    "category": "animation_binding",
    "name": "Crossbowman attack",
    "provider": "Unity editor / Codex",
    "status": "PLANNED_NOT_GENERATED",
    "approval": "PENDING",
    "source_path": null,
    "sha256": null,
    "rights_evidence": null,
    "depends_on": [
      "unit_crossbowman"
    ],
    "reuse_allowed": true,
    "sim_authoritative": true
  },
  {
    "id": "anim_crossbowman_hit",
    "category": "animation_binding",
    "name": "Crossbowman hit",
    "provider": "Unity editor / Codex",
    "status": "PLANNED_NOT_GENERATED",
    "approval": "PENDING",
    "source_path": null,
    "sha256": null,
    "rights_evidence": null,
    "depends_on": [
      "unit_crossbowman"
    ],
    "reuse_allowed": true,
    "sim_authoritative": true
  },
  {
    "id": "anim_crossbowman_death",
    "category": "animation_binding",
    "name": "Crossbowman death",
    "provider": "Unity editor / Codex",
    "status": "PLANNED_NOT_GENERATED",
    "approval": "PENDING",
    "source_path": null,
    "sha256": null,
    "rights_evidence": null,
    "depends_on": [
      "unit_crossbowman"
    ],
    "reuse_allowed": true,
    "sim_authoritative": true
  },
  {
    "id": "anim_crossbowman_victory",
    "category": "animation_binding",
    "name": "Crossbowman victory",
    "provider": "Unity editor / Codex",
    "status": "PLANNED_NOT_GENERATED",
    "approval": "PENDING",
    "source_path": null,
    "sha256": null,
    "rights_evidence": null,
    "depends_on": [
      "unit_crossbowman"
    ],
    "reuse_allowed": true,
    "sim_authoritative": true
  },
  {
    "id": "unit_grenadier",
    "category": "troop_master",
    "name": "Grenadier",
    "provider": "Higgsfield",
    "status": "PLANNED_NOT_GENERATED",
    "approval": "PENDING",
    "source_path": null,
    "sha256": null,
    "rights_evidence": null,
    "rig": "biped",
    "exchange": "segmented transparent PNG + pivots + original master",
    "commercial_clearance_required": true
  },
  {
    "id": "portrait_grenadier",
    "category": "unit_portrait",
    "name": "Grenadier portrait",
    "provider": "derived_from_approved_master",